{
  "schema_version": 1,
  "host": "codex",
  "explicit_action": null,
  "explicit_skill": null,
  "plain_answer": false,
  "simple_question": false,
  "project_context_required": false,
  "external_candidate": null,
  "hive_candidate": "refine-prompt",
  "active_hive_skills": [],
  "refine_mode": "refine-and-run",
  "explicit_run_intent": false
}
