{
  "schema_version": 1,
  "host": "codex",
  "explicit_action": null,
  "explicit_skill": "knowledge-recall",
  "plain_answer": false,
  "simple_question": true,
  "project_context_required": true,
  "external_candidate": {
    "name": "analyze",
    "provided_by": "omx",
    "compatible": true,
    "explicit_selection": true
  },
  "hive_candidate": "knowledge-recall",
  "active_hive_skills": [
    {
      "name": "knowledge-recall",
      "source_type": "built-in",
      "content_digest": "sha256:b1c993c5c9332596f2f71f0db2e40f42a434e210f71f4e8bb9f38da763c4b673",
      "side_effect_class": "read-only",
      "capabilities": ["filesystem-read", "memory-read", "shell"],
      "consent_digest": null,
      "consent": null
    }
  ],
  "refine_mode": null,
  "explicit_run_intent": false
}
