{
  "schema_version": 1,
  "host": "codex",
  "explicit_action": null,
  "explicit_skill": null,
  "plain_answer": false,
  "simple_question": true,
  "project_context_required": false,
  "external_candidate": null,
  "hive_candidate": "knowledge-recall",
  "active_hive_skills": [
    {
      "name": "quick-answer",
      "source_type": "built-in",
      "content_digest": "sha256:5478d281f28b39ec968afa8c80ea8230c4432c21fe299a4b6471c8df898c2206",
      "side_effect_class": "none",
      "capabilities": [],
      "consent_digest": null,
      "consent": null
    }
  ],
  "refine_mode": null,
  "explicit_run_intent": false
}
