{
  "schema_version": 1,
  "host": "codex",
  "explicit_action": null,
  "explicit_skill": null,
  "plain_answer": false,
  "simple_question": false,
  "project_context_required": false,
  "external_candidate": null,
  "hive_candidate": "hive-prompt-refine",
  "active_hive_skills": [
    {
      "name": "hive-prompt-refine",
      "source_type": "built-in",
      "content_digest": "sha256:581153b0d07539345372f0e87ab48c51b969dfe57a8e279353e35d000c4d8f76",
      "side_effect_class": "none",
      "capabilities": [],
      "consent_digest": null,
      "consent": null
    }
  ],
  "refine_mode": null,
  "explicit_run_intent": false
}
