{
  "schema_version": 1,
  "host": "codex",
  "explicit_action": "RefinePrompt",
  "explicit_skill": null,
  "plain_answer": false,
  "simple_question": false,
  "project_context_required": false,
  "external_candidate": null,
  "hive_candidate": "hive-prompt-refine",
  "active_hive_skills": [
    {
      "name": "hive-prompt-refine",
      "source_type": "built-in",
      "content_digest": "sha256:290ba87629582a4260f3e4c497d52571739edafa438329d310dfdcc6e04f962b",
      "side_effect_class": "none",
      "capabilities": [],
      "consent_digest": null,
      "consent": null
    }
  ],
  "refine_mode": "refine-and-run",
  "explicit_run_intent": true
}
