{
  "schema_version": 1,
  "host": "codex",
  "explicit_action": null,
  "explicit_skill": null,
  "plain_answer": false,
  "simple_question": false,
  "project_context_required": true,
  "external_candidate": null,
  "hive_candidate": null,
  "active_hive_skills": [
    {
      "name": "refine-prompt",
      "source_type": "built-in",
      "content_digest": "sha256:ee2de1307fbe22889b190a42e94ad38be9dd151d46ecc15c7928da91d0f287d2",
      "side_effect_class": "none",
      "capabilities": [],
      "consent_digest": null,
      "consent": null
    }
  ],
  "refine_mode": null,
  "explicit_run_intent": false,
  "prompt_quality": "ambiguous"
}
