{
  "schema_version": 1,
  "host": "codex",
  "explicit_action": null,
  "explicit_skill": null,
  "plain_answer": false,
  "simple_question": false,
  "project_context_required": false,
  "external_candidate": null,
  "hive_candidate": "search-knowledge",
  "active_hive_skills": [
    {
      "name": "search-knowledge",
      "source_type": "built-in",
      "content_digest": "sha256:0000000000000000000000000000000000000000000000000000000000000000",
      "side_effect_class": "read-only",
      "capabilities": ["filesystem-read", "memory-read", "shell"],
      "consent_digest": null,
      "consent": null
    }
  ],
  "refine_mode": null,
  "explicit_run_intent": false
}
