{
  "schema_version": 1,
  "host": "codex",
  "explicit_action": null,
  "explicit_skill": "hive-knowledge-query",
  "plain_answer": false,
  "simple_question": true,
  "project_context_required": true,
  "external_candidate": {
    "name": "analyze",
    "provided_by": "omx",
    "compatible": true,
    "explicit_selection": true
  },
  "hive_candidate": "hive-knowledge-query",
  "active_hive_skills": [
    {
      "name": "hive-knowledge-query",
      "source_type": "built-in",
      "content_digest": "sha256:c19a76a14e65332477b7ddf4779d59eb9f5ac7baaca44a3ac4384d050e40ccb0",
      "side_effect_class": "read-only",
      "capabilities": ["filesystem-read", "memory-read", "shell"],
      "consent_digest": null,
      "consent": null
    }
  ],
  "refine_mode": null,
  "explicit_run_intent": false
}
