{
  "schema_version": 1,
  "host": "codex",
  "explicit_action": null,
  "explicit_skill": null,
  "plain_answer": false,
  "simple_question": false,
  "project_context_required": false,
  "external_candidate": null,
  "hive_candidate": "prompt-refine",
  "active_hive_skills": [
    {
      "name": "prompt-refine",
      "source_type": "built-in",
      "content_digest": "sha256:bbd9a76fed57e1276aa94266709d79f656eafebc98e58723c5f8286b979399ed",
      "side_effect_class": "none",
      "capabilities": [],
      "consent_digest": null,
      "consent": null
    }
  ],
  "refine_mode": null,
  "explicit_run_intent": false
}
